{
  "schemaVersion": "yipyap.update-index.v1",
  "pluginId": "yipyap-language",
  "channel": "stable",
  "releaseSequence": 11,
  "version": "0.3.8",
  "releaseTag": "v0.3.8",
  "archiveUrl": "https://github.com/MagneumCo/yipyap-language/releases/download/v0.3.8/yipyap-language-0.3.8.tar",
  "archiveSha256": "939b969185872c9dd86d88336a2a34c6b584c9261504072ad888d99002821943",
  "manifestUrl": "https://github.com/MagneumCo/yipyap-language/releases/download/v0.3.8/manifest.json",
  "manifestSha256": "40ccd7a4c50c61fb02686e69b591c4ffe9f1ea7168f2f4567bd33dd5e68709fb",
  "signatureUrl": "https://github.com/MagneumCo/yipyap-language/releases/download/v0.3.8/manifest.sig",
  "signingKeyId": "yipyap-release-ed25519-v1",
  "minimumUpdaterVersion": "1.0.0",
  "expiresAt": "2026-10-29T20:55:31.000Z",
  "activation": "restart-new-root"
}
